sub_id,id,date_depot,etat_dossier,etat,zone_geo_projet,organisateur,statut_juridique,description_projet,coporteurs,partenaires,13_octobre,nom,description_action,est_accessible_pmr,lien_programme,lien_inscription,type_accessibilite,type_action,type_action_str,est_atelier_jeux,est_atelier_sensibilisation,est_conference,est_exercice_de_gestion_de_crise,est_exposition,est_formation,est_reunion_d_information,est_spectacle,est_visite_en_plein_air,est_visite_en_interieur,est_autre,public_cible_str,est_tout_public,est_jeune_public,est_public_vulnerable,est_risques_technologiques,est_risques_naturels,est_multirisques,est_gestes_qui_sauvent,risque_cible,risque_cible_str,est_inondations,est_feux_de_foret,est_tempete_cyclone,est_seisme,est_eruption_volcanique,est_mouvement_de_terrain,est_risques_littoraux,est_avalanche,est_radon,est_accidents_industriels,est_accidents_nucleaires,est_rupture_de_barrage,est_transport_de_matieres_dangereuses,est_dematerialisee,lien_demat,adresse,nom_commune,nom_departement,code_departement,insee_dep,nom_region,date_debut,date_fin,id_action,est_webinaire,est_application_numerique,est_article_journal,est_dossier_d_information_communal_des_risques_majeurs,est_jeu,"est_ouvrage_(libre,_guide...)",est_page_internet_intranet,est_plan_communal_et_ou_intercommunal_de_sauvegarde,part_JNR,nb_actions,public_cible_dossier,octobre,date,lat,lon
22713202_Sub_0,22713202,2025-02-26T14:49:33+01:00,accepte,accepte,14-CALVADOS,Préfecture du Calvados,Service de l’État,"À l’occasion de la sortie du film MAGMA, le Café des images, la DDTM et la préfecture du Calvados proposent une soirée autour des risques naturels et de leur gestion. La séance sera suivie d’une rencontre avec Philémon Perrot, directeur de cabinet du préfet du Calvados, Frédéric Gresselin, membre du GIEC normand, et Alexandre Royer, DDTM adjoint.
",Cinéma Le Café des Images,,False,"Projection du film ""Magma"" suivie d'un échange au cinéma Le Café des images","À l’occasion de la sortie du film MAGMA, le Café des images, la DDTM et la préfecture du Calvados proposent une soirée autour des risques naturels et de leur gestion. La séance sera suivie d’une rencontre avec Philémon Perrot, directeur de cabinet du préfet du Calvados, Frédéric Gresselin, membre du GIEC normand, et Alexandre Royer, DDTM adjoint.",True,https://cafedesimages.fr/evenements/magma-de-cyprien-vial-rencontre-sur-la-gestion-des-risques-naturels/,,Public,"Spectacle, Conférence","Spectacle,Conférence",False,False,True,False,False,False,False,True,False,False,False,Tout public,True,False,False,False,True,False,False,risques_naturels,"Éruption volcanique,Inondations,Feux de forêt,Tempête/cyclone,Risques littoraux,Mouvement de terrain",True,False,False,False,True,True,True,False,False,False,False,False,False,False,,4 square du théâtre,Hérouville-Saint-Clair,Calvados,14,14,Normandie,2025-03-27,2025-03-27,22713202_0_0,,,,,,,,,,,,,,49.202856,-0.332488
22826297_Sub_0,22826297,2025-03-04T12:18:53+01:00,accepte,accepte,56-MORBIHAN,Golfe du Morbihan - Vannes agglomération,Collectivité territoriale,"Dans le cadre du PAPI, GMVA accompagne les communes dans la réalisation, la mise à jour et le test de leur PCS. Dans ce cadre, des exercices de gestion de crise sont régulièrement organisés dans les communes.
",,,False,Exercice de gestion de crise - Le-Tour-du-Parc,"Dans le cadre du PAPI, GMVA accompagne les communes dans la réalisation, la mise à jour et le test de leur PCS. Dans ce cadre, des exercices de gestion de crise sont régulièrement organisés dans les communes.
L'exercice du Tour-du-Parc permettra de tester l'organisation de la gestion de crise de la commune en cas de tempête entraînant une submersion marine.
",False,,,Restreint,Exercice de gestion de crise,Exercice de gestion de crise,False,False,False,True,False,False,False,False,False,False,False,"Élu,Salarié/agent public",False,False,False,False,True,False,False,risques_naturels,"Tempête/cyclone,Risques littoraux",False,False,False,False,False,False,True,False,False,False,False,False,False,False,,1 rue de la mairie,Le Tour-du-Parc,Morbihan,56,56,Bretagne,2025-10-15,2025-10-15,22826297_0_0,,,,,,,,,,,,,,47.525958,-2.64507
22826297_Sub_1,22826297,2025-03-04T12:18:53+01:00,accepte,accepte,56-MORBIHAN,Golfe du Morbihan - Vannes agglomération,Collectivité territoriale,"Dans le cadre du PAPI, GMVA accompagne les communes dans la réalisation, la mise à jour et le test de leur PCS. Dans ce cadre, des exercices de gestion de crise sont régulièrement organisés dans les communes.
",,,False,Exercice de gestion de crise - Sarzeau,"Dans le cadre du PAPI, GMVA accompagne les communes dans la réalisation, la mise à jour et le test de leur PCS. Dans ce cadre, des exercices de gestion de crise sont régulièrement organisés dans les communes.
L'exercice de Sarzeau permettra de tester l'organisation de la gestion de crise de la commune en cas de tempête entraînant une submersion marine et l'organisation interne à GMVA.",False,,,Restreint,Exercice de gestion de crise,Exercice de gestion de crise,False,False,False,True,False,False,False,False,False,False,False,"Élu,Salarié/agent public",False,False,False,False,True,False,False,risques_naturels,"Inondations,Risques littoraux,Tempête/cyclone",True,False,False,False,False,False,True,False,False,False,False,False,False,False,,1 place richemont,Sarzeau,Morbihan,56,56,Bretagne,2025-03-14,2025-03-14,22826297_1_0,,,,,,,,,,,,,,47.527789,-2.768621
22826297_Sub_2,22826297,2025-03-04T12:18:53+01:00,accepte,accepte,56-MORBIHAN,Golfe du Morbihan - Vannes agglomération,Collectivité territoriale,"Dans le cadre du PAPI, GMVA accompagne les communes dans la réalisation, la mise à jour et le test de leur PCS. Dans ce cadre, des exercices de gestion de crise sont régulièrement organisés dans les communes.
",,,False,Exercice de gestion de crise - Colpo,"Dans le cadre du PAPI, GMVA accompagne les communes dans la réalisation, la mise à jour et le test de leur PCS. Dans ce cadre, des exercices de gestion de crise sont régulièrement organisés dans les communes.
L'exercice de Colpo permettra de tester l'organisation de la gestion de crise de la commune en cas de tempête entraînant une inondation par débordement de cours d'eau.",False,,,Restreint,Exercice de gestion de crise,Exercice de gestion de crise,False,False,False,True,False,False,False,False,False,False,False,Élu,False,False,False,False,True,False,False,risques_naturels,"Inondations,Tempête/cyclone",True,False,False,False,False,False,False,False,False,False,False,False,False,False,,12 avenue de la princesse,Colpo,Morbihan,56,56,Bretagne,2025-10-09,2025-10-09,22826297_2_0,,,,,,,,,,,,,,47.817984,-2.810939
22835597_Sub_0,22835597,2025-03-04T18:53:25+01:00,accepte,accepte,Zone FRANCE,CNRA (Conseil National pour la Résilience Alimentaire),Association,"Le CNRA (Conseil National pour la Résilience Alimentaire) a fait de la résilience alimentaire sa raison d'être. L'association a pour ADN de rapprocher tous les acteurs des systèmes alimentaires, et en particuliers les acteurs publics et privés, tout comme associatif, institutionnel ou industriel.
Le CNRA développe des outils concrets pour permettre le passage à l'action, dont un guide.",,"Les partenaires du guide sont institutionnels (AFNOR, Banque des Territoires, ADEME) aussi bien que privés (Eternity System, Grand Marché de Toulouse) ou publics (Région Sud, St Malo métropole). +200 bénévoles ont oeuvré à sa rédaction.
Les partenaires pour organiser la 3ème journée parlementaire pour sa diffusion sont encore à trouver. Une équipe de bénévoles y travaille déjà.",False,Diffusion du 1er Guide de bonnes pratiques pour la résilience alimentaire des territoires,"Le CNRA a réuni un tour de table de 200 personnes issues de tous l'écosystème alimentaire national (public et privé) pour écrire le 1er Guide de bonnes pratiques pour la résilience alimentaire des territoires.
Gratuit et accessible à tous, ce recueil rassemble 155 bonnes pratiques illustrées de solutions concrètes et applicables.",False,,,Création ou diffusion d'une ressource,"Ouvrage (livre, guide...)","Ouvrage (livre, guide...)",False,False,False,False,False,False,False,False,False,False,False,Tout public,True,False,False,False,False,True,False,multirisques,"Accidents industriels,Accidents nucléaires,Rupture de barrage,Inondations,Feux de forêt,Tempête/cyclone,Risques littoraux",True,False,False,False,False,False,True,False,False,True,True,True,False,True,https://www.cnra-france.org/les-outils-du-cnra/guide-bonnes-pratiques/,102 rue Amelot,Paris 11e Arrondissement,Paris,75,75,Île-de-France,2025-02-24,2025-12-31,22835597_0_0,,,,,,,,,,,,,,48.862392,2.36748
22860847_Sub_0,22860847,2025-03-06T08:47:34+01:00,accepte,accepte,82-TARN-ET-GARONNE,PREFECTURE DE DEPARTEMENT TARN-ET-GARONNE ,Service de l’État,"Cet atelier est conçu pour répondre aux attentes des élus en matière de prévention et de gestion des risques.
Le Tarn-et-Garonne est particulièrement vulnérable à plusieurs risques naturels et technologiques qui nécessitent une attention et une préparation constante. Ces enjeux nécessitent une action concertée.",,"- Gendarmerie nationale
- SDIS
- DMD
- DDT
- DREAL Occitanie",False,Atelier d'accuturation aux risques,"L'atelier est conçu pour être pratique et interactif :
    • Jouer un exercice de crise pour plonger les élus dans une situation réaliste et mettre en évidence les axes d’amélioration des dispositifs locaux.
    • Approfondir le travail autour des outils, notamment le PCS et le PICS.
    • Identifier les meilleures pratiques pour renforcer la résilience des territoires.",False,,,Restreint,"Atelier sensibilisation, Exercice de gestion de crise","Atelier sensibilisation,Exercice de gestion de crise",False,True,False,True,False,False,False,False,False,False,False,Élu,False,False,False,False,False,True,False,multirisques,"Accidents nucléaires,Rupture de barrage,Inondations",True,False,False,False,False,False,False,False,False,False,True,True,False,False,,1 Avenue de la Sorbonne,Nègrepelisse,Tarn-et-Garonne,82,82,Occitanie,2025-01-30,2025-01-30,22860847_0_0,,,,,,,,,,,,,,44.075382,1.522488
22895341_Sub_0,22895341,2025-03-07T10:05:23+01:00,accepte,accepte,94-VAL-DE-MARNE,PREFECTURE DE DEPARTEMENT VAL-DE-MARNE,Service de l’État,"Il s'agissait d'un exercice cadre réalisé en collaboration avec la commune de Villeneuve-le-Roi, la BSPP et les forces de l'ordre. L'objectif était de sensibiliser aux risques technologiques et notamment à la pollution de l'eau.",,Un partenariat a été réalisé avec la commune de Villeneuve-le-Roi.,False,Exercice PPI au SPVM de Villeneuve-le-Roi,"Il s'agissait d'un exercice cadre réalisé en collaboration avec la commune de Villeneuve-le-Roi, la BSPP et les forces de l'ordre. L'objectif était de sensibiliser aux risques technologiques et notamment à la pollution de l'eau.",False,,,Restreint,"Exercice de gestion de crise, Réunion d'information","Exercice de gestion de crise,Réunion d'information",False,False,False,True,False,False,True,False,False,False,False,"Salarié/agent public,Public vulnérable,Élu",False,False,False,True,False,False,False,risques_technologiques,"Accidents industriels,Rupture de barrage",False,False,False,False,False,False,False,False,False,True,False,True,False,False,,34 rue des darses,Villeneuve-le-Roi,Val-de-Marne,94,94,Île-de-France,2025-03-19,2025-03-19,22895341_0_0,,,,,,,,,,,,,,48.736292,2.431726
22895602_Sub_0,22895602,2025-03-07T10:13:36+01:00,accepte,accepte,94-VAL-DE-MARNE,PREFECTURE DE DEPARTEMENT VAL-DE-MARNE,Service de l’État,"La réunion de lancement du réseau des référents PCS/PICS 94 vise à fédérer les acteurs locaux autour de la planification et de la gestion de crise. Elle permettra d’échanger sur les bonnes pratiques, de renforcer la coordination entre collectivités et services de l’État, et de poser les bases d’une collaboration durable pour améliorer la résilience territoriale face aux risques.",,Un partenariat a été établit avec la DGSCGC et la DRIEAT pour la création d'atelier.,False,Réunion de lancement du réseau des référents PCS/PICS 94,"La réunion de lancement du réseau des référents PCS/PICS 94 vise à fédérer les acteurs locaux autour de la planification et de la gestion de crise. Elle permettra d’échanger sur les bonnes pratiques, de renforcer la coordination entre collectivités et services de l’État, et de poser les bases d’une collaboration durable pour améliorer la résilience territoriale face aux risques.",True,,,Public,"Réunion d'information, Conférence","Réunion d'information,Conférence",False,False,True,False,False,False,True,False,False,False,False,Tout public,True,False,False,False,False,True,False,multirisques,"Accidents industriels,Transport de matières dangereuses,Inondations,Mouvement de terrain",True,False,False,False,False,True,False,False,False,True,False,False,True,False,,21 avenue du Général-de-Gaulle,Créteil,Val-de-Marne,94,94,Île-de-France,2025-03-05,2025-03-05,22895602_0_0,,,,,,,,,,,,,,48.782827,2.452463
22962114_Sub_0,22962114,2025-03-11T10:48:03+01:00,accepte,accepte,62-PAS-DE-CALAIS,Un particulier,Particulier (majeur),"J'organise régulièrement, à destination du grand public, des volontaires du Service National Universel, des institutions publiques (collèges, lycées, universités) des interventions pour préparer la population face aux catastrophes (naturelles, industrielles, terroristes) via la formation ""AGIR FACE A UNE CATASTROPHE"" ainsi qu'en formant aux Gestes Qui Sauvent.",,"- Associations Professionnelles Secours Tactiques Nord et Pas-de-Calais
- Polytech LILLE
- Centres du Service National Universel du Nord et du Pas de Calais",False,Formation Agir face à une catastrophe,"Connaitre les catastrophes et les risques, identifier les actions à mettre en place en amont et pendant une catastrophe, identifier les acteurs et le rôle du citoyen lors d'une catastrophe.",False,,,Restreint,"Formation, Atelier sensibilisation","Formation,Atelier sensibilisation",False,True,False,False,False,True,False,False,False,False,False,"Étudiant,Scolaire,Salarié/agent public",False,False,False,False,False,True,False,multirisques,"Accidents industriels,Accidents nucléaires,Rupture de barrage,Transport de matières dangereuses,Inondations,Feux de forêt,Tempête/cyclone,Séisme,Éruption volcanique,Risques littoraux,Mouvement de terrain,Avalanche",True,False,False,True,True,True,True,True,False,True,True,True,True,False,,15 rue René Lanoy,Lens,Pas-de-Calais,62,62,Hauts-de-France,2025-03-29,2025-12-31,22962114_0_0,,,,,,,,,,,,,,50.430295,2.833281
22989559_Sub_0,22989559,2025-03-12T11:47:13+01:00,accepte,accepte,24-DORDOGNE,PREFECTURE DE LA DORDOGNE  - SIDPC 24,Service de l’État,"Le SIDPC propose un accompagnement accru des élus à la rédaction des plans communaux de sauvegarde sous forme d'intervention en EPCI.
Cette intervention se traduit par la projection des documents supports et par des échanges avec les élus concernés. Elle est suivie d'un accompagnement au fil de l'eau jusqu'à la finalisation du document. 
Ces interventions sont dans la continuité des travaux engagés auprès de 06 EPCI en 2024. 14 EPCI seront concernés cette année. Les dates d'intervention continueront d'être fixés au fil de l'année. ",PREFECTURE DE LA DORDOGNE - SIDPC 24,Ce projet se construit autour des élus et des présidents des communautés de communes. ,False,Intervention en EPCI,"Présentation des documents supports d'aide à la rédaction des PCS
Sensibilisation sur les objectifs des PCS ",False,,,Restreint,"Atelier sensibilisation, Conférence","Atelier sensibilisation,Conférence",False,True,True,False,False,False,False,False,False,False,False,Élu,False,False,False,False,False,True,False,multirisques,"Accidents industriels,Accidents nucléaires,Rupture de barrage,Transport de matières dangereuses,Inondations,Feux de forêt,Mouvement de terrain",True,False,False,False,False,True,False,False,False,True,True,True,True,False,,1 ZONE INDUCTRIELLE LA BORIE,Saint-Astier,Dordogne,24,24,Nouvelle-Aquitaine,2025-02-27,2025-10-30,22989559_0_0,,,,,,,,,,,,,,45.2811,4.182497
23009515_Sub_0,23009515,2025-03-13T08:39:52+01:00,accepte,accepte,38-ISERE,MAIRIE DE CRETS EN BELLEDONNE,Collectivité territoriale,"La collectivité à récemment réalisé son PCS, ce projet à permis à l'ensemble des personnes de prendre conscience des enjeux du PCS et notamment de la gestion, organisation de celui ci. Afin de développer des compétences, s'approprier les réflexes nécessaires en cas de crises, d'utiliser les bonnes solutions et dans une démarche d'amélioration continue a ce sujet. ",INSTITUT DES RISQUES MAJEURS - IRMA,"Dans le cadre de ce partenarait nous aimerions nous attacher les services : élus, agents, bénévoles, sécurité civil, SDIS, gendarmeries, Préfecture, Communauté de Communes, SYMBHI, Commune voisines",False,EXERCICE PCS,"Afin de développer des compétences, s'approprier les réflexes nécessaires en cas de crises, d'utiliser les bonnes solutions et dans une démarche d'amélioration continue a ce sujet la collectivité souhaite tester la capacité qu'elle à en cas de gestion de crise et d'identifier les axes",False,,,Restreint,"Exercice de gestion de crise, Atelier sensibilisation, Atelier Jeux, Formation","Exercice de gestion de crise,Atelier sensibilisation,Atelier Jeux,Formation",True,True,False,True,False,True,False,False,False,False,False,"Élu,Salarié/agent public,Public vulnérable,Scolaire",False,False,False,False,False,True,False,multirisques,"Accidents industriels,Inondations,Mouvement de terrain,Radon,Séisme,Feux de forêt",True,False,False,True,False,True,False,False,True,True,False,False,False,False,,1 PLACE DE LA MAIRIE,Crêts en Belledonne,Isère,38,38,Auvergne-Rhône-Alpes,2025-06-02,2025-10-31,23009515_0_0,,,,,,,,,,,,,,45.374314,6.045949
23087320_Sub_0,23087320,2025-03-17T14:56:00+01:00,accepte,accepte,24-DORDOGNE,Préfecture de la Dordogne,Service de l’État,"Dans le cadre d'un partenariat le SIDPC intervient auprès des élèves de l'institut de formation aux métiers de la santé de Périgueux.
Accompagnés d'officiers du SDIS, de médecins du SAMU et de formateurs de la police nationale, cette intervention vise à sensibiliser le public sur les objectifs des exercices de sécurité civile. 
",Préfecture de la Dordogne,"SDIS
FSI
SAMU",False,Présentation des exercices de sécurité civile aux étudiants en soins infirmiers de Périgueux,"L'intervention se décomposera de la façon suivante:
- présentation d'un dossier d'exercice et des objectifs
- les partenaires et leur implication dans la construction des exercices
- le rôle de la préfecture et du SIDPC dans la coordination inter-services
- les grands principes de l'inter opérabilité
- échanges avec les étudiants sur l'exercice NOVI de décembre 2024",False,,,Restreint,Réunion d'information,Réunion d'information,False,False,False,False,False,False,True,False,False,False,False,Étudiant,False,False,False,False,False,False,True,gestes_qui_sauvent,Gestes qui sauvent,False,False,False,False,False,False,False,False,False,False,False,False,False,False,,80 avenue Georges Pompidou ,Périgueux,Dordogne,24,24,Nouvelle-Aquitaine,2025-03-20,2025-03-20,23087320_0_0,,,,,,,,,,,,,,45.193579,0.728594
22961811_Sub_0,22961811,2025-03-17T14:56:20+01:00,accepte,accepte,60-OISE,"Lycée Saint-Esprit, Beauvais (0601699W)",Établissement scolaire,"Nous avons labellisées deux classes engagées, SNU, et nous travaillons sur le thème de la résilience. Donc nous avons labélisée en 2024 un projet pour la JNR. Puis nous comptons continuer notre engagement avec nos deux classes à travers une mise en situation de gestion de crise avec nos 2 classes engagées (une à la fois), sur un exercice inondation.",,"Les différents partenaires :
-Professeurs
-Préfecture
-SDIS (pompiers)
-Force de l'ordre
-Communication
-Gestion du territoire
-Syndicat des eaux",False,Exercice inondation,"-Présentation succincte des différents services présents
-Point Météo avec présentation des impacts
-Jeux, sélection et tris des impacts
-Travail en sous groupe
-Restitution du travail en sous groupe
-débrief
-Météo prédictive
-Travail en commun sur les recherches des enjeux et impacts
-Travail en sous groupe
-Restitution
-Debrief
-Conclusion",False,,,Restreint,Exercice de gestion de crise,Exercice de gestion de crise,False,False,False,True,False,False,False,False,False,False,False,Scolaire,False,False,False,False,True,False,False,risques_naturels,Inondations,True,False,False,False,False,False,False,False,False,False,False,False,False,False,,68 rue de Pontoise,Beauvais,Oise,60,60,Hauts-de-France,2025-03-13,2025-03-13,22961811_0_0,,,,,,,,,,,,,,49.419112,2.086665
23131286_Sub_0,23131286,2025-03-19T11:26:49+01:00,accepte,accepte,91-ESSONNE,"Collège Mondétour, Les Ulis (0911127F)",Établissement scolaire,"Organisation d'une sensibilisation des élèves de 6èmes aux risques majeurs, dans le cadre du CESC et du parcours citoyen. Chaque classe suit un parcours de sensibilisation d'une heure avec présentation des conduites à tenir avant de s'exercer.",,,False,Sensibilisation aux risque majeurs,"Les élèves suivent une heure de sensibilisation par classe, heure qui est consacrée à : 
- Explication d’un risque majeur, 
- Présentation de l’ensemble des risques existants avec vidéos
- Identification des risques pour notre collège avec une cartographie et des exercices interactifs. 
- Explications sur la démarche à suivre et comment y faire face. Des courtes vidéos viennent en appui ainsi que l’écoute des différentes sonneries d’alerte. 
- Résumé sous forme de questionnaire pour vérifier les acquis et permettre de mettre en place des automatismes 
- Mise en pratique par un exercice de mise en situation dans les semaines suivantes avec information aux familles grâce à un flyer",False,,,Restreint,"Formation, Atelier sensibilisation","Formation,Atelier sensibilisation",False,True,False,False,False,True,False,False,False,False,False,Scolaire,False,False,False,False,False,True,False,multirisques,"Accidents industriels,Accidents nucléaires,Transport de matières dangereuses,Tempête/cyclone,Feux de forêt",False,False,False,False,False,False,False,False,False,True,True,False,True,False,,4 RUE DES LORRAINS,Les Ulis,Essonne,91,91,Île-de-France,2025-04-28,2026-07-01,23131286_0_0,,,,,,,,,,,,,,48.68447,2.179795
23134177_Sub_0,23134177,2025-03-19T13:16:23+01:00,accepte,accepte,972-MARTINIQUE,NOUVEL ELAN TRINITEEN,Association,"Permettre aux personnes en mobilité réduite d’être sensibilisées aux risques et bénéficier d’un accompagnement (formation) aux gestes qui sauvent.
Faire connaître les dispositifs existants au niveau réglementaire et matériel.
",APAJH de Martinique,"Les partenariats envisagés : 
-	Services de la ville (Police municipale, services techniques…)
-	Services de l’État (Direction de la sécurité civile, Agence régionale de Santé, DEAL, Gendarmerie, Police.),
-	Organismes publics ou privés (sponsors et autres financeurs),
-	Associations d’handicapés,
-	Associations d’Aidants familiaux,
-	Moyens humains et volontaires.
",False,HANDI-SEISME,"Il s’agit, en partenariat avec l’APAJH de Martinique, d’organiser une journée « HANDI-SEISME"" en l’adaptant aux différents types de handicaps, notamment les Personnes en mobilité réduite (fauteuil...), Il s’agit dans ce cadre de un exercice « HANDI-REPLIK » et  d’organiser une conférence de presse ou une table ronde sur la même thématique.
",True,,,Public,"Atelier sensibilisation, Conférence, Réunion d'information, Exercice de gestion de crise","Atelier sensibilisation,Conférence,Réunion d'information,Exercice de gestion de crise",False,True,True,True,False,False,True,False,False,False,False,"Tout public,Public vulnérable",True,False,False,False,False,False,True,gestes_qui_sauvent,Gestes qui sauvent,False,False,False,False,False,False,False,False,False,False,False,False,False,False,,0 Quartier Dijon,La Trinité,Martinique,972,972,Martinique,2025-09-20,2025-09-20,23134177_0_0,,,,,,,,,,,,,,14.742725,-60.964291
